[
  {
    "Id": "fixture-0001",
    "FirstName": "Test",
    "LastName": "Testerson",
    "Occupation": "Fictional Fitness Coach and Speaker",
    "DashEntityUrn": "urn:test:fixture:0001",
    "ObjectUrn": "urn:li:member:0000000001",
    "SuccessfullLikes": 10,
    "SuccessfullComments": 2,
    "piFirstName": "Test",
    "piLastName": "Testerson",
    "Comment": "Great fictional point!",
    "Url": "https://www.linkedin.com/feed/update/urn:li:activity:0000000000000000000/",
    "liProfileLink": "<a href='https://www.linkedin.com/in/TEST0001'>Digital Marketer: Testerson, Test</a>",
    "liUrl": "<a href='https://example.invalid'>https://example.invalid</a>",
    "liDigitalMarketer": "Digital Marketer: Testerson, Test",
    "Title": "This is a fictional target post used for fixture testing.",
    "VolumeId": 1,
    "UserId": "operator-fixture-0001",
    "country": "Testland"
  },
  {
    "Id": "fixture-0002",
    "FirstName": "Another",
    "LastName": "Fictional",
    "Occupation": "Fictional Financial Advisor",
    "DashEntityUrn": "urn:test:fixture:0002",
    "ObjectUrn": "urn:li:member:0000000001",
    "SuccessfullLikes": 4,
    "SuccessfullComments": 1,
    "piFirstName": "Another",
    "piLastName": "Fictional",
    "Comment": "Guaranteed returns, act now!",
    "Url": "https://www.linkedin.com/feed/update/urn:li:activity:0000000000000000000/",
    "liProfileLink": "<a href='https://www.linkedin.com/in/TEST0002'>Digital Marketer: Fictional, Another</a>",
    "liUrl": "<a href='https://example.invalid'>https://example.invalid</a>",
    "liDigitalMarketer": "Digital Marketer: Fictional, Another",
    "Title": "This is a fictional target post used for fixture testing.",
    "VolumeId": 1,
    "UserId": "operator-fixture-0002",
    "country": "Testania"
  }
]
